{
  "schema_version": "1.0.0",
  "corpus_id": "learnpilot-rag-real-world-corpus",
  "corpus_version": "v1",
  "acquired_at": "2026-08-13T12:33:34.949269+00:00",
  "document_count": 11,
  "format_plan": {
    "md": 8,
    "txt": 1,
    "pdf": 2
  },
  "topic_plan": {
    "rag_retrieval": 2,
    "agent_engineering": 3,
    "ai_app_backend": 3,
    "evaluation_reliability": 3
  },
  "licenses": [
    {
      "project": "FAISS",
      "spdx_identifier": "MIT",
      "repository_path": "evals/rag_real_world_corpus/v1/provenance/licenses/faiss-MIT.txt",
      "source": "https://github.com/facebookresearch/faiss/blob/80a16564f86530dbf0bfaf96c2b71feffeb5093f/LICENSE",
      "sha256": "f08a94bfb0bdc1d7f1cb59badaf0f8c551b10db871185622dbf1fd036affa9cb"
    },
    {
      "project": "FastAPI",
      "spdx_identifier": "MIT",
      "repository_path": "evals/rag_real_world_corpus/v1/provenance/licenses/fastapi-MIT.txt",
      "source": "https://github.com/fastapi/fastapi/blob/f336ff831c4af3d4f625c2593a27b1e0cae93eb7/LICENSE",
      "sha256": "2853a942962e3bb755239b5fecb736503be392554c1d90f97cea7f29f4465d34"
    },
    {
      "project": "FlagEmbedding",
      "spdx_identifier": "MIT",
      "repository_path": "evals/rag_real_world_corpus/v1/provenance/licenses/FlagEmbedding-MIT.txt",
      "source": "https://github.com/FlagOpen/FlagEmbedding/blob/7ed43d67ec03fbe5c31c0992dbfa941fb1860549/LICENSE",
      "sha256": "d2066728cf4edc752cb7542fb20b97a3cde20fdb26e8d0f0e0900f0fa0ac43ef"
    },
    {
      "project": "LangChain Documentation",
      "spdx_identifier": "MIT",
      "repository_path": "evals/rag_real_world_corpus/v1/provenance/licenses/langchain-docs-MIT.txt",
      "source": "https://github.com/langchain-ai/docs/blob/47062bb8dc8eb56fb7cdd99201028e1d0177b19b/LICENSE",
      "sha256": "9bc75ced0dc6df655c7ac6a3787012fe364e8fa7b499fda048543102f5cbdee3"
    },
    {
      "project": "LangGraph",
      "spdx_identifier": "MIT",
      "repository_path": "evals/rag_real_world_corpus/v1/provenance/licenses/langgraph-MIT.txt",
      "source": "https://github.com/langchain-ai/langgraph/blob/644815f9e5bc52ad8f7a5227a456227e9c3e639b/LICENSE",
      "sha256": "ab08cf7f0b8d47e474d2e66e0212f18f6c70f5097f404de8a35c665012c9b199"
    },
    {
      "project": "OpenTelemetry Website",
      "spdx_identifier": "CC-BY-4.0",
      "repository_path": "evals/rag_real_world_corpus/v1/provenance/licenses/opentelemetry.io-CC-BY-4.0.txt",
      "source": "https://github.com/open-telemetry/opentelemetry.io/blob/0480294d04e49023b559d33d4546a34ce738fcab/LICENSE",
      "sha256": "3dd00169d72711f03353b5a2e2122d7294bb69d2cb62b27509bccb40b154789b"
    },
    {
      "project": "Ragas",
      "spdx_identifier": "Apache-2.0",
      "repository_path": "evals/rag_real_world_corpus/v1/provenance/licenses/ragas-Apache-2.0.txt",
      "source": "https://github.com/vibrantlabsai/ragas/blob/298b68274234c060deacab3cf5fb52aa3a20e885/LICENSE",
      "sha256": "4acca6f8cbd03e143ec8578672daea43e7ce362ec71521a8e203958e69562975"
    }
  ],
  "documents": [
    {
      "document_id": "rw-rag-bge-m3",
      "title": "BGE-M3: Multi-Functionality Retrieval",
      "topic_cluster": "rag_retrieval",
      "source_format": "md",
      "repository_path": "evals/rag_real_world_corpus/v1/corpus/rw-rag-bge-m3.md",
      "upstream_project": "FlagEmbedding",
      "upstream_repository": "https://github.com/FlagOpen/FlagEmbedding",
      "upstream_commit_sha": "7ed43d67ec03fbe5c31c0992dbfa941fb1860549",
      "upstream_path_or_source": "research/BGE_M3/README.md",
      "retrieved_at": "2026-08-13T12:33:34.949269+00:00",
      "license": "MIT",
      "license_source": "https://github.com/FlagOpen/FlagEmbedding/blob/7ed43d67ec03fbe5c31c0992dbfa941fb1860549/LICENSE",
      "license_repository_path": "evals/rag_real_world_corpus/v1/provenance/licenses/FlagEmbedding-MIT.txt",
      "license_sha256": "d2066728cf4edc752cb7542fb20b97a3cde20fdb26e8d0f0e0900f0fa0ac43ef",
      "attribution": "FlagEmbedding contributors; source retained under MIT",
      "source_sha256": "716e66d3a954813afb7cee5dc4c0d56c1bb106e0e40e057ede32c9e796edee87",
      "corpus_sha256": "716e66d3a954813afb7cee5dc4c0d56c1bb106e0e40e057ede32c9e796edee87",
      "transformation": {
        "method": "verbatim byte copy",
        "content_rewritten": false
      },
      "language": "en",
      "notes": "Official pinned upstream documentation; no semantic rewriting."
    },
    {
      "document_id": "rw-rag-faiss-overview",
      "title": "FAISS Overview and Index Trade-offs",
      "topic_cluster": "rag_retrieval",
      "source_format": "md",
      "repository_path": "evals/rag_real_world_corpus/v1/corpus/rw-rag-faiss-overview.md",
      "upstream_project": "FAISS",
      "upstream_repository": "https://github.com/facebookresearch/faiss",
      "upstream_commit_sha": "80a16564f86530dbf0bfaf96c2b71feffeb5093f",
      "upstream_path_or_source": "README.md",
      "retrieved_at": "2026-08-13T12:33:34.949269+00:00",
      "license": "MIT",
      "license_source": "https://github.com/facebookresearch/faiss/blob/80a16564f86530dbf0bfaf96c2b71feffeb5093f/LICENSE",
      "license_repository_path": "evals/rag_real_world_corpus/v1/provenance/licenses/faiss-MIT.txt",
      "license_sha256": "f08a94bfb0bdc1d7f1cb59badaf0f8c551b10db871185622dbf1fd036affa9cb",
      "attribution": "FAISS contributors; source retained under MIT",
      "source_sha256": "ff24d50bbbe48398f309a9400c2e73695344a14301d97d6eb72629e9fa4ef786",
      "corpus_sha256": "ff24d50bbbe48398f309a9400c2e73695344a14301d97d6eb72629e9fa4ef786",
      "transformation": {
        "method": "verbatim byte copy",
        "content_rewritten": false
      },
      "language": "en",
      "notes": "Official pinned upstream documentation; no semantic rewriting."
    },
    {
      "document_id": "rw-agent-langgraph-overview",
      "title": "LangGraph Repository Overview",
      "topic_cluster": "agent_engineering",
      "source_format": "md",
      "repository_path": "evals/rag_real_world_corpus/v1/corpus/rw-agent-langgraph-overview.md",
      "upstream_project": "LangGraph",
      "upstream_repository": "https://github.com/langchain-ai/langgraph",
      "upstream_commit_sha": "644815f9e5bc52ad8f7a5227a456227e9c3e639b",
      "upstream_path_or_source": "README.md",
      "retrieved_at": "2026-08-13T12:33:34.949269+00:00",
      "license": "MIT",
      "license_source": "https://github.com/langchain-ai/langgraph/blob/644815f9e5bc52ad8f7a5227a456227e9c3e639b/LICENSE",
      "license_repository_path": "evals/rag_real_world_corpus/v1/provenance/licenses/langgraph-MIT.txt",
      "license_sha256": "ab08cf7f0b8d47e474d2e66e0212f18f6c70f5097f404de8a35c665012c9b199",
      "attribution": "LangGraph contributors; source retained under MIT",
      "source_sha256": "4b5bf18421432989b6e46f22751fed5d0a14a908628e039fc6e1d6543d1e858c",
      "corpus_sha256": "4b5bf18421432989b6e46f22751fed5d0a14a908628e039fc6e1d6543d1e858c",
      "transformation": {
        "method": "verbatim byte copy",
        "content_rewritten": false
      },
      "language": "en",
      "notes": "Official pinned upstream documentation; no semantic rewriting."
    },
    {
      "document_id": "rw-agent-persistence",
      "title": "LangGraph Persistence and Checkpointing",
      "topic_cluster": "agent_engineering",
      "source_format": "txt",
      "repository_path": "evals/rag_real_world_corpus/v1/corpus/rw-agent-persistence.txt",
      "upstream_project": "LangChain Documentation",
      "upstream_repository": "https://github.com/langchain-ai/docs",
      "upstream_commit_sha": "47062bb8dc8eb56fb7cdd99201028e1d0177b19b",
      "upstream_path_or_source": "src/oss/langgraph/persistence.mdx",
      "retrieved_at": "2026-08-13T12:33:34.949269+00:00",
      "license": "MIT",
      "license_source": "https://github.com/langchain-ai/docs/blob/47062bb8dc8eb56fb7cdd99201028e1d0177b19b/LICENSE",
      "license_repository_path": "evals/rag_real_world_corpus/v1/provenance/licenses/langchain-docs-MIT.txt",
      "license_sha256": "9bc75ced0dc6df655c7ac6a3787012fe364e8fa7b499fda048543102f5cbdee3",
      "attribution": "LangChain Documentation contributors; source retained under MIT",
      "source_sha256": "0b2be3426fc43a7d5da8d98f316ca93a1e4951e47a12d286d1fdb2d5a3edfc17",
      "corpus_sha256": "0b2be3426fc43a7d5da8d98f316ca93a1e4951e47a12d286d1fdb2d5a3edfc17",
      "transformation": {
        "method": "verbatim byte copy with container extension changed to UTF-8 TXT",
        "content_rewritten": false
      },
      "language": "en",
      "notes": "Official pinned upstream documentation; no semantic rewriting."
    },
    {
      "document_id": "rw-agent-interrupts",
      "title": "LangGraph Interrupts and Human-in-the-loop",
      "topic_cluster": "agent_engineering",
      "source_format": "pdf",
      "repository_path": "evals/rag_real_world_corpus/v1/corpus/rw-agent-interrupts.pdf",
      "upstream_project": "LangChain Documentation",
      "upstream_repository": "https://github.com/langchain-ai/docs",
      "upstream_commit_sha": "47062bb8dc8eb56fb7cdd99201028e1d0177b19b",
      "upstream_path_or_source": "src/oss/langgraph/interrupts.mdx",
      "retrieved_at": "2026-08-13T12:33:34.949269+00:00",
      "license": "MIT",
      "license_source": "https://github.com/langchain-ai/docs/blob/47062bb8dc8eb56fb7cdd99201028e1d0177b19b/LICENSE",
      "license_repository_path": "evals/rag_real_world_corpus/v1/provenance/licenses/langchain-docs-MIT.txt",
      "license_sha256": "9bc75ced0dc6df655c7ac6a3787012fe364e8fa7b499fda048543102f5cbdee3",
      "attribution": "LangChain Documentation contributors; source retained under MIT",
      "source_sha256": "5cc75e29c33c40a1b27721206a3739fd2ba945588a25a639305587822696ca0a",
      "corpus_sha256": "42aab890b1009f736e41d6160caddaee49ca06da25252a77b756710d26869909",
      "transformation": {